{"schema":"testing-result-authority-receipt.v1","canonicalization":"fkst-testing-result-authority-canonical-json.v1","receipt_id":"r","run_id":"run","invocation_id":"inv","admitted_release_ref":{"kind":"release","ref":"immutable://release","sha256":"aaaaaaaaaaaaaaaaaaaaaaaaaaaaaaaaaaaaaaaaaaaaaaaaaaaaaaaaaaaaaaaa"},"admission_digest":"bbbbbbbbbbbbbbbbbbbbbbbbbbbbbbbbbbbbbbbbbbbbbbbbbbbbbbbbbbbbbbbb","package_id":"testing-runner","package_version":"1.0.0","package_content_sha256":"cccccccccccccccccccccccccccccccccccccccccccccccccccccccccccccccc","manifest_digest":"dddddddddddddddddddddddddddddddddddddddddddddddddddddddddddddddd","executor_id":"testing-package-executor.browser-title.v1","structured_plan_ref":{"kind":"plan","ref":"immutable://plan","sha256":"eeeeeeeeeeeeeeeeeeeeeeeeeeeeeeeeeeeeeeeeeeeeeeeeeeeeeeeeeeeeeeee"},"reducer":{"schema":"testing-assertion-reducer-identity.v1","reducer_id":"testing.assertion-reducer.browser-title-equals","reducer_version":"1.0.0","reducer_sha256":"ffffffffffffffffffffffffffffffffffffffffffffffffffffffffffffffff","policy_profile":"browser-title-equals.v1","supported_result_contract_majors":["testing-case-result-set.v2"]},"case_result_set_ref":{"kind":"artifact","ref":"result","sha256":"1111111111111111111111111111111111111111111111111111111111111111"},"case_result_set_content_sha256":"2222222222222222222222222222222222222222222222222222222222222222","evidence_manifest_ref":{"kind":"artifact","ref":"evidence","sha256":"3333333333333333333333333333333333333333333333333333333333333333"},"evidence_manifest_content_sha256":"4444444444444444444444444444444444444444444444444444444444444444","completed_execution_sha256":"5555555555555555555555555555555555555555555555555555555555555555","classification":"lost_or_inconclusive","receipt_sha256":"6666666666666666666666666666666666666666666666666666666666666666"}
